{
  "proposalId": "MIP-21",
  "summary": "Gas optimisation of the Vault via a VaultV2 implementation upgrade; no change to ownership.",
  "actions": [
    {
      "kind": "upgrade",
      "target": "0x0165878A594ca255338adfa4d48449f69242Eb8F",
      "description": "Upgrade the Vault to VaultV2 (storage packing / gas optimisation only).",
      "citations": [
        {
          "chunkId": "MIP-21:forum:0",
          "sha256": "0x3ace16e3c9d03df25105c8ab715142e86300f0d0381f2d41592c6725115a0ebe",
          "quote": "VaultV2 packs reserveCap and lastRebalance into one slot",
          "sourceUri": "forum://MIP-21/forum_thread.json#post=1"
        },
        {
          "chunkId": "MIP-21:pdf:0",
          "sha256": "0xa72aa6f8dbdbc090d4ce0e95eda2a13b8460cb2242d3a3406198306e7cef8885",
          "quote": "The upgrade replaces the Vault implementation behind the existing UUPS proxy",
          "sourceUri": "pdf://MIP-21/proposal.pdf#page=3"
        }
      ]
    }
  ],
  "explicitlyExcluded": [
    "change to ownership"
  ],
  "confidence": 0.91
}
